{
  "cpu": {
    "architecture": "x86_64",
    "cores_per_socket": "12",
    "cpu_mhz_max_observed": 2153.858,
    "cpu_mhz_min_observed": 1555.139,
    "cpu_op_modes": "32-bit, 64-bit",
    "flags": [
      "fpu",
      "vme",
      "de",
      "pse",
      "tsc",
      "msr",
      "pae",
      "mce",
      "cx8",
      "apic",
      "sep",
      "mtrr",
      "pge",
      "mca",
      "cmov",
      "pat",
      "pse36",
      "clflush",
      "mmx",
      "fxsr",
      "sse",
      "sse2",
      "ht",
      "syscall",
      "nx",
      "mmxext",
      "fxsr_opt",
      "pdpe1gb",
      "rdtscp",
      "lm",
      "constant_tsc",
      "rep_good",
      "amd_lbr_v2",
      "nopl",
      "xtopology",
      "nonstop_tsc",
      "cpuid",
      "extd_apicid",
      "aperfmperf",
      "rapl",
      "pni",
      "pclmulqdq",
      "monitor",
      "ssse3",
      "fma",
      "cx16",
      "sse4_1",
      "sse4_2",
      "movbe",
      "popcnt",
      "aes",
      "xsave",
      "avx",
      "f16c",
      "rdrand",
      "lahf_lm",
      "cmp_legacy",
      "svm",
      "extapic",
      "cr8_legacy",
      "abm",
      "sse4a",
      "misalignsse",
      "3dnowprefetch",
      "osvw",
      "ibs",
      "skinit",
      "wdt",
      "tce",
      "topoext",
      "perfctr_core",
      "perfctr_nb",
      "bpext",
      "perfctr_llc",
      "mwaitx",
      "cpuid_fault",
      "cpb",
      "cat_l3",
      "cdp_l3",
      "hw_pstate",
      "ssbd",
      "mba",
      "perfmon_v2",
      "ibrs",
      "ibpb",
      "stibp",
      "ibrs_enhanced",
      "vmmcall",
      "fsgsbase",
      "tsc_adjust",
      "bmi1",
      "avx2",
      "smep",
      "bmi2",
      "erms",
      "invpcid",
      "cqm",
      "rdt_a",
      "avx512f",
      "avx512dq",
      "adx",
      "smap",
      "avx512ifma",
      "clflushopt",
      "clwb",
      "avx512cd",
      "sha_ni",
      "avx512bw",
      "avx512vl",
      "xsaveopt",
      "xsavec",
      "xgetbv1",
      "xsaves",
      "cqm_llc",
      "cqm_occup_llc",
      "cqm_mbm_total",
      "cqm_mbm_local",
      "user_shstk",
      "avx_vnni",
      "avx512_bf16",
      "clzero",
      "irperf",
      "xsaveerptr",
      "rdpru",
      "wbnoinvd",
      "cppc",
      "arat",
      "npt",
      "lbrv",
      "svm_lock",
      "nrip_save",
      "tsc_scale",
      "vmcb_clean",
      "flushbyasid",
      "decodeassists",
      "pausefilter",
      "pfthreshold",
      "avic",
      "v_vmsave_vmload",
      "vgif",
      "x2avic",
      "v_spec_ctrl",
      "vnmi",
      "avx512vbmi",
      "umip",
      "pku",
      "ospke",
      "avx512_vbmi2",
      "gfni",
      "vaes",
      "vpclmulqdq",
      "avx512_vnni",
      "avx512_bitalg",
      "avx512_vpopcntdq",
      "rdpid",
      "bus_lock_detect",
      "movdiri",
      "movdir64b",
      "overflow_recov",
      "succor",
      "smca",
      "fsrm",
      "avx512_vp2intersect",
      "flush_l1d",
      "amd_lbr_pmc_freeze"
    ],
    "logical_processors": 24,
    "lscpu": {
      "lscpu": [
        {
          "data": "x86_64",
          "field": "Architecture:"
        },
        {
          "data": "32-bit, 64-bit",
          "field": "CPU op-mode(s):"
        },
        {
          "data": "48 bits physical, 48 bits virtual",
          "field": "Address sizes:"
        },
        {
          "data": "Little Endian",
          "field": "Byte Order:"
        },
        {
          "data": "24",
          "field": "CPU(s):"
        },
        {
          "data": "0-23",
          "field": "On-line CPU(s) list:"
        },
        {
          "data": "AuthenticAMD",
          "field": "Vendor ID:"
        },
        {
          "data": "AMD Ryzen AI 9 HX 370 w/ Radeon 890M",
          "field": "Model name:"
        },
        {
          "data": "26",
          "field": "CPU family:"
        },
        {
          "data": "36",
          "field": "Model:"
        },
        {
          "data": "2",
          "field": "Thread(s) per core:"
        },
        {
          "data": "12",
          "field": "Core(s) per socket:"
        },
        {
          "data": "1",
          "field": "Socket(s):"
        },
        {
          "data": "0",
          "field": "Stepping:"
        },
        {
          "data": "enabled",
          "field": "Frequency boost:"
        },
        {
          "data": "45%",
          "field": "CPU(s) scaling MHz:"
        },
        {
          "data": "5157.8950",
          "field": "CPU max MHz:"
        },
        {
          "data": "605.2640",
          "field": "CPU min MHz:"
        },
        {
          "data": "3992.42",
          "field": "BogoMIPS:"
        },
        {
          "data": "fpu vme de pse tsc msr pae mce cx8 apic sep mtrr pge mca cmov pat pse36 clflush mmx fxsr sse sse2 ht syscall nx mmxext fxsr_opt pdpe1gb rdtscp lm constant_tsc rep_good amd_lbr_v2 nopl xtopology nonstop_tsc cpuid extd_apicid aperfmperf rapl pni pclmulqdq monitor ssse3 fma cx16 sse4_1 sse4_2 movbe popcnt aes xsave avx f16c rdrand lahf_lm cmp_legacy svm extapic cr8_legacy abm sse4a misalignsse 3dnowprefetch osvw ibs skinit wdt tce topoext perfctr_core perfctr_nb bpext perfctr_llc mwaitx cpuid_fault cpb cat_l3 cdp_l3 hw_pstate ssbd mba perfmon_v2 ibrs ibpb stibp ibrs_enhanced vmmcall fsgsbase tsc_adjust bmi1 avx2 smep bmi2 erms invpcid cqm rdt_a avx512f avx512dq adx smap avx512ifma clflushopt clwb avx512cd sha_ni avx512bw avx512vl xsaveopt xsavec xgetbv1 xsaves cqm_llc cqm_occup_llc cqm_mbm_total cqm_mbm_local user_shstk avx_vnni avx512_bf16 clzero irperf xsaveerptr rdpru wbnoinvd cppc arat npt lbrv svm_lock nrip_save tsc_scale vmcb_clean flushbyasid decodeassists pausefilter pfthreshold avic v_vmsave_vmload vgif x2avic v_spec_ctrl vnmi avx512vbmi umip pku ospke avx512_vbmi2 gfni vaes vpclmulqdq avx512_vnni avx512_bitalg avx512_vpopcntdq rdpid bus_lock_detect movdiri movdir64b overflow_recov succor smca fsrm avx512_vp2intersect flush_l1d amd_lbr_pmc_freeze",
          "field": "Flags:"
        },
        {
          "data": "AMD-V",
          "field": "Virtualization:"
        },
        {
          "data": "576 KiB (12 instances)",
          "field": "L1d cache:"
        },
        {
          "data": "384 KiB (12 instances)",
          "field": "L1i cache:"
        },
        {
          "data": "12 MiB (12 instances)",
          "field": "L2 cache:"
        },
        {
          "data": "24 MiB (2 instances)",
          "field": "L3 cache:"
        },
        {
          "data": "1",
          "field": "NUMA node(s):"
        },
        {
          "data": "0-23",
          "field": "NUMA node0 CPU(s):"
        },
        {
          "data": "Not affected",
          "field": "Vulnerability Gather data sampling:"
        },
        {
          "data": "Not affected",
          "field": "Vulnerability Ghostwrite:"
        },
        {
          "data": "Not affected",
          "field": "Vulnerability Indirect target selection:"
        },
        {
          "data": "Not affected",
          "field": "Vulnerability Itlb multihit:"
        },
        {
          "data": "Not affected",
          "field": "Vulnerability L1tf:"
        },
        {
          "data": "Not affected",
          "field": "Vulnerability Mds:"
        },
        {
          "data": "Not affected",
          "field": "Vulnerability Meltdown:"
        },
        {
          "data": "Not affected",
          "field": "Vulnerability Mmio stale data:"
        },
        {
          "data": "Not affected",
          "field": "Vulnerability Old microcode:"
        },
        {
          "data": "Not affected",
          "field": "Vulnerability Reg file data sampling:"
        },
        {
          "data": "Not affected",
          "field": "Vulnerability Retbleed:"
        },
        {
          "data": "Mitigation; IBPB on VMEXIT only",
          "field": "Vulnerability Spec rstack overflow:"
        },
        {
          "data": "Mitigation; Speculative Store Bypass disabled via prctl",
          "field": "Vulnerability Spec store bypass:"
        },
        {
          "data": "Mitigation; usercopy/swapgs barriers and __user pointer sanitization",
          "field": "Vulnerability Spectre v1:"
        },
        {
          "data": "Mitigation; Enhanced / Automatic IBRS; IBPB conditional; STIBP always-on; PBRSB-eIBRS Not affected; BHI Not affected",
          "field": "Vulnerability Spectre v2:"
        },
        {
          "data": "Not affected",
          "field": "Vulnerability Srbds:"
        },
        {
          "data": "Not affected",
          "field": "Vulnerability Tsa:"
        },
        {
          "data": "Not affected",
          "field": "Vulnerability Tsx async abort:"
        },
        {
          "data": "Mitigation; IBPB on VMEXIT",
          "field": "Vulnerability Vmscape:"
        }
      ]
    },
    "lscpu_command": {
      "available": true,
      "command": [
        "lscpu",
        "--json"
      ],
      "json_error": null,
      "ok": true,
      "returncode": 0,
      "stderr": ""
    },
    "model_name": "AMD Ryzen AI 9 HX 370 w/ Radeon 890M",
    "sockets": "1",
    "source": "lscpu+proc_cpuinfo",
    "threads_per_core": "2",
    "vendor_id": "AuthenticAMD"
  },
  "created_at_utc": "2026-07-16T02:36:10.338173+00:00",
  "gpu": {
    "lspci_command": {
      "available": true,
      "command": [
        "lspci"
      ],
      "json_error": null,
      "ok": true,
      "returncode": 0,
      "stderr": ""
    },
    "lspci_gpus": [
      {
        "lspci_line": "c6:00.0 Display controller: Advanced Micro Devices, Inc. [AMD/ATI] Device 150e (rev c1)"
      }
    ],
    "nvidia": {
      "available": false,
      "command": {
        "available": false,
        "command": [
          "nvidia-smi",
          "--query-gpu=index,name,driver_version,memory.total,memory.used,memory.free,temperature.gpu,power.draw,power.limit,utilization.gpu",
          "--format=csv,noheader,nounits"
        ],